{
  "schema_version": 1,
  "generated_at": "2026-04-07T10:00:06Z",
  "time_window": {
    "kind": "today",
    "since": "2026-04-07T07:00:00Z",
    "until": "2026-04-07T10:00:04.232016Z"
  },
  "budget": {
    "scope": "global",
    "period": "daily",
    "limitUSD": 0,
    "currentUSD": 74.84081900000005,
    "pct": null,
    "level": "none"
  },
  "spend": {
    "generatedAt": "2026-04-07T10:00:04Z",
    "window": "today",
    "filters": {
      "since": null,
      "until": null,
      "team_id": null,
      "session_id": null,
      "project": null
    },
    "source": "local",
    "ccusage": {
      "ok": false,
      "summary": null,
      "error": "[Errno 2] No such file or directory: 'ccusage'"
    },
    "local": {
      "source": "local",
      "filteredMessages": 766,
      "totals": {
        "inputTokens": 1819,
        "outputTokens": 156801,
        "cacheCreationTokens": 5185902,
        "cacheReadTokens": 48781619,
        "localCostUSD": 74.84081900000005,
        "localCostKnown": true,
        "messages": 766
      },
      "models": {
        "claude-opus-4-6": {
          "messages": 409,
          "inputTokens": 757,
          "outputTokens": 111316,
          "cacheCreationTokens": 4350346,
          "cacheReadTokens": 41087007,
          "localCostUSD": 66.83364200000008,
          "localCostKnown": true
        },
        "<synthetic>": {
          "messages": 3,
          "inputTokens": 0,
          "outputTokens": 0,
          "cacheCreationTokens": 0,
          "cacheReadTokens": 0,
          "localCostUSD": 0.0,
          "localCostKnown": true
        },
        "claude-sonnet-4-6": {
          "messages": 354,
          "inputTokens": 1062,
          "outputTokens": 45485,
          "cacheCreationTokens": 835556,
          "cacheReadTokens": 7694612,
          "localCostUSD": 8.007176999999997,
          "localCostKnown": true
        }
      },
      "sessions": {
        "a695cb24": {
          "messages": 17,
          "inputTokens": 37,
          "outputTokens": 2079,
          "cacheCreationTokens": 373742,
          "cacheReadTokens": 839658,
          "teamId": null,
          "memberId": null,
          "models": [
            "claude-opus-4-6"
          ]
        },
        "4f1bc0bb": {
          "messages": 19,
          "inputTokens": 25,
          "outputTokens": 5848,
          "cacheCreationTokens": 435941,
          "cacheReadTokens": 2242104,
          "teamId": null,
          "memberId": null,
          "models": [
            "claude-opus-4-6"
          ]
        },
        "c2f45926": {
          "messages": 66,
          "inputTokens": 117,
          "outputTokens": 54062,
          "cacheCreationTokens": 699108,
          "cacheReadTokens": 7790475,
          "teamId": null,
          "memberId": null,
          "models": [
            "<synthetic>",
            "claude-opus-4-6"
          ]
        },
        "9d0c0bac": {
          "messages": 207,
          "inputTokens": 273,
          "outputTokens": 44780,
          "cacheCreationTokens": 637368,
          "cacheReadTokens": 24135612,
          "teamId": null,
          "memberId": null,
          "models": [
            "claude-opus-4-6"
          ]
        },
        "efa92a30": {
          "messages": 1,
          "inputTokens": 3,
          "outputTokens": 72,
          "cacheCreationTokens": 0,
          "cacheReadTokens": 6026,
          "teamId": null,
          "memberId": null,
          "models": [
            "claude-sonnet-4-6"
          ]
        },
        "36b7c818": {
          "messages": 2,
          "inputTokens": 6,
          "outputTokens": 84,
          "cacheCreationTokens": 0,
          "cacheReadTokens": 12052,
          "teamId": null,
          "memberId": null,
          "models": [
            "claude-sonnet-4-6"
          ]
        },
        "8a2268cb": {
          "messages": 2,
          "inputTokens": 6,
          "outputTokens": 146,
          "cacheCreationTokens": 12166,
          "cacheReadTokens": 0,
          "teamId": null,
          "memberId": null,
          "models": [
            "claude-sonnet-4-6"
          ]
        },
        "d71d7412": {
          "messages": 1,
          "inputTokens": 3,
          "outputTokens": 2,
          "cacheCreationTokens": 6607,
          "cacheReadTokens": 0,
          "teamId": null,
          "memberId": null,
          "models": [
            "claude-sonnet-4-6"
          ]
        },
        "d74cff94": {
          "messages": 2,
          "inputTokens": 6,
          "outputTokens": 67,
          "cacheCreationTokens": 0,
          "cacheReadTokens": 12052,
          "teamId": null,
          "memberId": null,
          "models": [
            "claude-sonnet-4-6"
          ]
        },
        "08bf65df": {
          "messages": 9,
          "inputTokens": 27,
          "outputTokens": 1744,
          "cacheCreationTokens": 28776,
          "cacheReadTokens": 112274,
          "teamId": null,
          "memberId": null,
          "models": [
            "claude-sonnet-4-6"
          ]
        },
        "866e1d5b": {
          "messages": 7,
          "inputTokens": 21,
          "outputTokens": 918,
          "cacheCreationTokens": 31750,
          "cacheReadTokens": 50979,
          "teamId": null,
          "memberId": null,
          "models": [
            "claude-sonnet-4-6"
          ]
        },
        "9953598e": {
          "messages": 1,
          "inputTokens": 3,
          "outputTokens": 6,
          "cacheCreationTokens": 0,
          "cacheReadTokens": 6026,
          "teamId": null,
          "memberId": null,
          "models": [
            "claude-sonnet-4-6"
          ]
        },
        "b0677171": {
          "messages": 1,
          "inputTokens": 3,
          "outputTokens": 2,
          "cacheCreationTokens": 0,
          "cacheReadTokens": 6026,
          "teamId": null,
          "memberId": null,
          "models": [
            "claude-sonnet-4-6"
          ]
        },
        "c900568c": {
          "messages": 5,
          "inputTokens": 15,
          "outputTokens": 849,
          "cacheCreationTokens": 34570,
          "cacheReadTokens": 40251,
          "teamId": null,
          "memberId": null,
          "models": [
            "claude-sonnet-4-6"
          ]
        },
        "993f498c": {
          "messages": 1,
          "inputTokens": 3,
          "outputTokens": 0,
          "cacheCreationTokens": 0,
          "cacheReadTokens": 6026,
          "teamId": null,
          "memberId": null,
          "models": [
            "claude-sonnet-4-6"
          ]
        },
        "f0e36c0c": {
          "messages": 2,
          "inputTokens": 6,
          "outputTokens": 99,
          "cacheCreationTokens": 0,
          "cacheReadTokens": 12052,
          "teamId": null,
          "memberId": null,
          "models": [
            "claude-sonnet-4-6"
          ]
        },
        "01de39e7": {
          "messages": 26,
          "inputTokens": 78,
          "outputTokens": 4712,
          "cacheCreationTokens": 30128,
          "cacheReadTokens": 259469,
          "teamId": null,
          "memberId": null,
          "models": [
            "claude-sonnet-4-6"
          ]
        },
        "29f5f846": {
          "messages": 13,
          "inputTokens": 39,
          "outputTokens": 1634,
          "cacheCreationTokens": 32900,
          "cacheReadTokens": 108263,
          "teamId": null,
          "memberId": null,
          "models": [
            "claude-sonnet-4-6"
          ]
        },
        "a96cb9ab": {
          "messages": 2,
          "inputTokens": 6,
          "outputTokens": 77,
          "cacheCreationTokens": 0,
          "cacheReadTokens": 12052,
          "teamId": null,
          "memberId": null,
          "models": [
            "claude-sonnet-4-6"
          ]
        },
        "8d3fc504": {
          "messages": 1,
          "inputTokens": 3,
          "outputTokens": 6,
          "cacheCreationTokens": 0,
          "cacheReadTokens": 6026,
          "teamId": null,
          "memberId": null,
          "models": [
            "claude-sonnet-4-6"
          ]
        },
        "db9ff9a1": {
          "messages": 2,
          "inputTokens": 6,
          "outputTokens": 12,
          "cacheCreationTokens": 12438,
          "cacheReadTokens": 0,
          "teamId": null,
          "memberId": null,
          "models": [
            "claude-sonnet-4-6"
          ]
        },
        "c0249751": {
          "messages": 1,
          "inputTokens": 0,
          "outputTokens": 0,
          "cacheCreationTokens": 0,
          "cacheReadTokens": 0,
          "teamId": null,
          "memberId": null,
          "models": [
            "<synthetic>"
          ]
        },
        "7513296f": {
          "messages": 10,
          "inputTokens": 30,
          "outputTokens": 2240,
          "cacheCreationTokens": 23865,
          "cacheReadTokens": 78139,
          "teamId": null,
          "memberId": null,
          "models": [
            "claude-sonnet-4-6"
          ]
        },
        "ead95453": {
          "messages": 38,
          "inputTokens": 114,
          "outputTokens": 4694,
          "cacheCreationTokens": 31304,
          "cacheReadTokens": 470424,
          "teamId": null,
          "memberId": null,
          "models": [
            "claude-sonnet-4-6"
          ]
        },
        "88e387f1": {
          "messages": 2,
          "inputTokens": 6,
          "outputTokens": 422,
          "cacheCreationTokens": 12240,
          "cacheReadTokens": 0,
          "teamId": null,
          "memberId": null,
          "models": [
            "claude-sonnet-4-6"
          ]
        },
        "5b5671e6": {
          "messages": 24,
          "inputTokens": 72,
          "outputTokens": 4911,
          "cacheCreationTokens": 42416,
          "cacheReadTokens": 639467,
          "teamId": null,
          "memberId": null,
          "models": [